{
  "provenance_id": "automationbench/sales-1202@4a8e1061254004d9dac807054eed33fad7d1ff14",
  "source_type": "public_dataset",
  "source_uri": "https://github.com/zapier/AutomationBench/blob/4a8e1061254004d9dac807054eed33fad7d1ff14/automationbench/domains/sales/tasks.py",
  "acquired_at": "2026-09-01T18:10:00+08:00",
  "license": "MIT；保留 AutomationBench LICENSE 和精确 commit",
  "privacy_status": "通过",
  "human_rewritten": true,
  "synthetic": true,
  "publishability": "public",
  "source_sha256": [
    "ceec7bfba68bd79b0462a2692da48c45a1b224a0b8b2294d7018fdbb5903e691",
    "14076974e47d6e05239bddcc117c99b353f89d183acb4ddd7cb3b8771eea9e02",
    "37650d72d7f23b3a5edc0c30382127e6b6dad03812ae7ffa281981b41aeb8f00",
    "2bc1c5314d6bc8d93d086a95baf25800bc7c0a4df9b65e4f3659b59b116c586d"
  ],
  "notes": "保留 AutomationBench 1202 的2封邮件、4条 Tracker 记录、7个账户、8个联系人、1个 Slack 频道、11个断言和原 Query。人工改造为离线 XLSX/DOCX/MBOX/JSON 交付包，未增加账户、金额、日期、联系人或权限事实。"
}
