{
  "provenance_id": "omegause-officeval/officeval_046@ffbeecb8752447c8e40b594a0eeb1db7236ecb36",
  "source_type": "public_dataset",
  "source_uri": "https://huggingface.co/datasets/baidu-frontier-research/OmegaUse-OfficeVal/tree/cd6ba6d8fb83b3fb551e24eebc20e1fb0bd154a5/task_files/officeval_046",
  "acquired_at": "2026-08-26T15:58:00+08:00",
  "license": "Apache-2.0；保留上游 LICENSE 与精确 commit",
  "privacy_status": "通过",
  "human_rewritten": true,
  "synthetic": true,
  "publishability": "public",
  "source_sha256": ["b09980a366b1de100a43518a4b9cafe7543950af09921b055c64a645d8cd4149", "6b5bf5dacaf7e53c03103df37050e0e25027e21eedc1d06ccdb8965e1b3d7d50"],
  "notes": "上游代码 commit ffbeecb8752447c8e40b594a0eeb1db7236ecb36，数据 commit cd6ba6d8fb83b3fb551e24eebc20e1fb0bd154a5。上游 Query、Rubric、Verifier 和 LICENSE 已精确保留。"
}
