{"provenance_id":"spreadsheet-rl/6f274cd4cbc27e656d7ddae7c3b591669866dc84@b07dec0d38d63663","source_type":"public_dataset","source_uri":"https://huggingface.co/datasets/Spreadsheet-RL/Spreadsheet-RL/tree/6f274cd4cbc27e656d7ddae7c3b591669866dc84/excelforum/excel-general/task-job-b07dec0d38d63663","acquired_at":"2026-08-31T01:00:00+08:00","license":"CC-BY-SA-4.0; dataset revision fixed and archived locally","privacy_status":"通过","human_rewritten":true,"synthetic":true,"publishability":"public","source_sha256":["3195814da1d869b35721a1a60f100192b5ddd2e106971c9856a0b0a33def2fa2"],"notes":"Ground-truth ID and answer range AB4:AB10 retained as audit evidence; local Judge independently recomputes FIFO from Transactions."}
