{
  "provenance_id": "docx-004-editing-rewriting",
  "source_type": "synthetic",
  "source_uri": "https://github.com/baidu-frontier-research/OmegaUse-OfficeVal",
  "acquired_at": "2026-08-24T00:00:00+08:00",
  "license": "CC0-1.0（本项目合成输入）；参考代码许可见 003-Reference 索引",
  "privacy_status": "通过",
  "human_rewritten": true,
  "synthetic": true,
  "publishability": "public",
  "source_sha256": [
    "f5ac1517891501bee10a1859c5a3c3fbc7117a5b30db3c0b3432b2413249540e",
    "c73a5eeff5a3d39adfe49ec61add9c72c5f21b97564a97ba9b4d25b5c76e450f"
  ],
  "notes": "只参考任务形态与 Judge 设计，未复制上游用户内容。参考：https://github.com/baidu-frontier-research/OmegaUse-OfficeVal；https://github.com/nberk/llm-docx-editing"
}
