{
  "provenance_id": "omegause-officeval/officeval_086@ffbeecb8752447c8e40b594a0eeb1db7236ecb36",
  "source_type": "public_dataset",
  "source_uri": "https://huggingface.co/datasets/baidu-frontier-research/OmegaUse-OfficeVal/tree/main/task_files/officeval_086",
  "acquired_at": "2026-08-24T03:44:00+08:00",
  "license": "Apache-2.0；保留上游 LICENSE 与精确 commit",
  "privacy_status": "通过",
  "human_rewritten": true,
  "synthetic": true,
  "publishability": "public",
  "source_sha256": [
    "20613e39c87d8dd68e27c3368b7014ac09dcec3a77d94e56d8548880aa246743",
    "72786b96b5ccb28c265bb5d6dc355dd719e35add623fb596848c662eea01b62c"
  ],
  "notes": "来源仓库 OmegaUse-OfficeVal，commit ffbeecb8752447c8e40b594a0eeb1db7236ecb36。source_sha256 与两个实际输入一一对应；原始 Query、Rubric、Verifier 和 LICENSE 原样保存在 adaptation/ 与 tests/upstream_verifier.py。"
}
