{
  "provenance_id": "synthetic/ppt-012-board-deck-audit",
  "source_type": "synthetic",
  "source_uri": "synthetic://cowork-evolution-benchmark/ppt-012-board-deck-audit",
  "acquired_at": "2026-08-24T12:00:00+08:00",
  "license": "CC-BY-4.0（本项目新编合成材料）",
  "privacy_status": "通过",
  "human_rewritten": true,
  "synthetic": true,
  "publishability": "public",
  "source_sha256": [
    "72260a261316dd362457a76518fa05986e55d1dfb72e14c674818fb7cb841393",
    "f59744f97151b1db9c1f64f24e580c84c61b75e5c42594e10edef4454b9f30b1",
    "f3f8c83e3c536d97c312a7faba8cac2d92cf1c37c5f4518d6041e83ff4d74033"
  ],
  "notes": "本题所有业务名称、数据、图像和办公文件均由项目制题者合成，不含真实个人或客户数据。 参考仓库仅用于任务形式与Rubric设计，未复制其任务文件：PPTArena/src/evaluation_pairs_refined.json (https://github.com/michaelofengenden/PPTArena)；PPT-Eval/task_registry/tasks.json (https://github.com/microsoft/ppteval)；OmegaUse-OfficeVal/data/rubrics-en/officeval_003.json (https://github.com/baidu-frontier-research/OmegaUse-OfficeVal)。输入文件SHA256：董事会品牌与审计规范.md=72260a261316dd362457a76518fa05986e55d1dfb72e14c674818fb7cb841393; 董事会数据基准.xlsx=f59744f97151b1db9c1f64f24e580c84c61b75e5c42594e10edef4454b9f30b1; 董事会经营简报_待审计.pptx=f3f8c83e3c536d97c312a7faba8cac2d92cf1c37c5f4518d6041e83ff4d74033。"
}
