{
  "provenance_id": "cross-001-extract-analyze-present",
  "source_type": "synthetic",
  "source_uri": "https://github.com/0717376/cowork_bench",
  "acquired_at": "2026-08-24T00:00:00+08:00",
  "license": "CC0-1.0（本项目合成输入）；参考代码许可见 003-Reference 索引",
  "privacy_status": "通过",
  "human_rewritten": true,
  "synthetic": true,
  "publishability": "public",
  "source_sha256": [
    "9b8c6dc88941225cff5343df5d112228940eac038e70564cce193e632dbc595d",
    "a42dc674006697e67e46bc7dc07e15078b43ef6d476efbb780f32029074a1d1e"
  ],
  "notes": "只参考任务形态与 Judge 设计，未复制上游用户内容。参考：https://github.com/0717376/cowork_bench；https://github.com/OpenDataBox/Workspace-Bench"
}
