{
  "provenance_id": "cross-003-shared-source-multi-output",
  "source_type": "synthetic",
  "source_uri": "https://github.com/OpenDataBox/Workspace-Bench",
  "acquired_at": "2026-08-24T00:00:00+08:00",
  "license": "CC0-1.0（本项目合成输入）；参考代码许可见 003-Reference 索引",
  "privacy_status": "通过",
  "human_rewritten": true,
  "synthetic": true,
  "publishability": "public",
  "source_sha256": [
    "a8ae76b9366c0be39eb90a1c1ebe9b5bb916cc7ecb6eb029ecac2ade32031cac"
  ],
  "notes": "只参考任务形态与 Judge 设计，未复制上游用户内容。参考：https://github.com/OpenDataBox/Workspace-Bench；https://github.com/0717376/cowork_bench"
}
